filename,length(sec),proc_time(sec),wer,actual_text,processed_text
3331-159609-0000.flac,18.73,43.891999999999996,0.115,never mind what the business was it suffices to say that it was a good beginning for a young man like tom who having been born and bred in the most conservative class of the most conceited city in new england needed just the healthy hearty social influences of the west to widen his views and make a man of him,never mind what the business was it suffices to say that it was a good beginning for young men like me who have been born and bred in the most conservative forces of the most conceited city in new england needed just the healthy hardly social influences of the west to win his views and make a man of him
5442-41169-0018.flac,3.945,8.266,0.333,oh well one does it what would you have,oh well i wonder what would you have
4198-61336-0027.flac,3.53,7.736,0.571,he swept through israel like a hurricane,he went to his well like a hurricane
533-131564-0026.flac,3.915,6.747,0.286,you never tried me milly said he,you never told me said he
5484-24317-0024.flac,13.86,26.249000000000002,0.244,he winked at her and made a significant gesture as he spoke and then informed the blind artist how graciously arsinoe had remembered him when she heard of the remedy by whose aid many a wonderful cure of blind eyes had been made in rhodes,he wanted her and made a significant gesture ass he spoke and then informed applied artist how graciously arsenal had remembered him when she heard of the family by whose aid many a wonderful care of blind i had been made inroads
3764-168670-0039.flac,3.1700625,8.801,0.538,you can come and nail me up in the coffin at two o'clock,you can come and only upon the coffin to cook
3764-168671-0023.flac,3.76,8.922,0.5,the grave digger yes,the baton yes
3538-163622-0011.flac,8.415,16.143,0.214,the two brothers laughed at him and his father and mother begged him not to go but all to no purpose and cinderlad set out on his way,but the brothers laughed at him and his father and mother did not to go but all to no purpose in and set out on his way
3528-168669-0113.flac,6.56,12.142,0.174,if you were ever to have any other jobs of this sort my brother is the strong man for you a perfect turk,if you were ever to have any other jobs of the sort my brothers the strong man for you the perfect turk
6938-70848-0010.flac,4.52,12.311,0.364,these men especially welcomed the call to a congress of peasants,this man especially welcome the call to a congress of buses
1688-142285-0024.flac,9.015,12.955,0.105,papa i do think mister thornton a very remarkable man but personally i don't like him at all,papa i do think mister thornton a very remarkable man but personally i dont like him at all
533-131556-0001.flac,3.505,8.766,0.8,for none could injure me as he has done oh,for consumers is done so
2609-169640-0018.flac,6.185,14.608,0.444,the question was now whether we could pass them or not before they got near enough to grapple,the question was not whether we could pass the night before they got into battle
1998-15444-0008.flac,2.945,7.069,0.625,the dose for an adult is ten minims,the data that is ten minutes
4350-9170-0046.flac,6.165,9.308,0.048,except for the state they say we should be exposed to the attacks of evil disposed persons in our own country,except for the state they say we should be exposed to the attacks of evil displaced persons in our own country
2609-169640-0012.flac,2.545,6.958,0.75,a breathless stillness succeeded,a breakfast indicated
2033-164916-0001.flac,24.56,51.864,0.382,know o chief wazir that here where you have encountered me allah hath given you rest from fatigue and bringeth you your desire after the easiest of fashions for that his almighty will restoreth to you zau al makan and his sister nuzhat al zaman whereby we will settle the matter as we easily can,nor chief wazir that here where you have encountered at all have even the rest from fatigue and bring us your desire after the easiest of fashions for that italy will restore it to you somethin and his sister no situation whereby we will settle the matter as they can
1998-15444-0015.flac,5.42,9.402,0.231,notice the smell colour and general appearance of the matter submitted for examination,notice the smile and general appearance of the matters submitted for examination
6128-63244-0014.flac,12.995,31.481,0.525,i look after the details as well as the big currents missus farrinder added in a tone as explanatory as could be expected of such a woman and with a smile of which the sweetness was thrilling to her listener,after the details as well as the current missus mandated internet explorer as can be expected of sexuality and with a smile which the sweetness finalised
3764-168671-0002.flac,7.67,13.049000000000001,0.227,a mourning coach in which could be seen a priest in his surplice and a choir boy in his red cap followed,the morning coach in which could be seen a priest in his place and acquire boy in his red cap followed
3005-163391-0004.flac,2.83,4.364,0.5,wher you bound for young man,where are you bound for a young man
533-1066-0014.flac,2.47,2.939,0.0,i asked no questions,i asked no questions
4350-9170-0031.flac,9.67,16.773,0.118,every increase in the army of one state with the aim of self defense against its subjects becomes a source of danger for neighboring states and calls for a similar increase in their armies,every increase in the army at one stage with the aim of self defence against its subjects becomes a source of danger for neighbouring states and calls for a similar increase in their armies
2609-169640-0004.flac,10.84,26.53,0.652,mister marble he i do believe was fairly snoozing on the hen coops being like the sails as one might say barely asleep,mister marble and businesses in the groups and the sailors as one might say variously
3764-168671-0003.flac,5.82,11.146,0.333,behind it came an old man in the garments of a laborer who limped along,behind it came an old man in the garments of the labour and liberal one
3538-163622-0005.flac,5.91,12.801,0.5,then the king promised him the same punishment and the same reward that he had promised his brother,in writing promised in the same punishment and the same reward those promises brother
7902-96592-0040.flac,4.805,9.195,0.267,not you look like a wild beast in a cage like a monkey you insolent,now you would like a wild beast in a cage with a monkey you insult
4294-9934-0026.flac,5.43,9.684,0.286,that will be swallowing a tongue very fast or a hundred sous very slowly,i will be following the tongue very fast or a hundred so very slowly
3764-168671-0027.flac,4.635,7.5969999999999995,0.4,it is true nevertheless that grave diggers do die themselves,it is true nevertheless that the greatest engine themselves
8461-278226-0004.flac,7.815,18.947,0.565,i remember all the rubenses at the louvre for i saw them three years ago when i was staying in paris with grandpapa,into the room and said look for some years ago when i was in paris with grandpa
3764-168671-0036.flac,4.25,10.42,0.667,fauchelevent passed the unexpected gribier once more in review,fortunately unexpectedly once more in love
2033-164915-0007.flac,13.605,26.06,0.387,she said it hath reached me o auspicious king that when the stoker girthed his ass for flight and bespake himself saying oh would i knew what is become of him,she said it hath reached me o auspicious king tat when the stock of goods has replied and spoke himself saying and what is become of him
6128-63240-0007.flac,14.99,29.191,0.237,these things the eyes especially with their smouldering fire might have indicated that he was to be a great american statesman or on the other hand they might simply have proved that he came from carolina or alabama,this this is especially with the smouldering fire might have indicated that he was to be a great american statesmen or on the other hand that i simply have proved that he came from carolina alabama
3080-5032-0003.flac,4.04,7.622,0.455,why did you not send me that news and a garland,why did you not say that means and the golan
3764-168670-0009.flac,4.14,8.239,0.222,fauchelevent grumbled more to himself than to jean valjean,for she grumbled more to himself than to jean valjean
1998-29455-0037.flac,6.65,14.641,0.273,nor was it sunday on which they took a rest and washed their shirts according to mister beale's rule of life,nor was the sunday on which they took a rest and rather short according to mister is full of life
367-130732-0033.flac,15.91,36.497,0.308,this butter is made as follows place the shells on a baking sheet in the oven to dry let the shells cool and then pound them in a mortar with a little lobster coral and four ounces of fresh butter thoroughly bruising the whole together so as to make a fine paste,this matter is made as follows place cells in a dish in the oven to dry let the shell cool and then found them in the water with a little lobster conformances fresh butter thoroughly bringing the whole together so as to make a fine paste
367-130732-0022.flac,7.45,15.223999999999998,0.464,so far it has been used mostly for garnishment of other dishes and it is only recently that the hof brau has been making a specialty of them,so far as the user consignment of other dishes and it is only recently that the whole browser making especially of them
3528-168669-0003.flac,3.515,4.534,0.143,reverend mother do you know the chapel,reverend mother do you know the trouble
1688-142285-0058.flac,3.885,6.575,0.091,remember who gave it you and made it what it is,remember who gave it to you and made it what it is
533-131564-0023.flac,6.215,11.844,0.308,nay not i said he turning her round and pushing her towards me,no not i said he turning around and pushing it towards me
3528-168669-0020.flac,2.425,2.55,0.0,i am here to do anything you wish,i am here to do anything you wish
3997-182399-0020.flac,4.445,8.123,0.182,it was just as good as one of grandfather frog's,it was just as good as those of grandfather frog
4852-28312-0012.flac,3.605,9.33,0.455,jakey harris his name is and he really needs the job,his name is now really is the job
533-1066-0017.flac,5.48,10.267,0.583,the doctor was puffing somewhat when we finally came to a halt,do not those falling somewhat will finally come to a halt
2033-164914-0000.flac,9.075,17.141,0.316,replied he of a truth i heard him not and i wot him not and folks are all sleeping,reply of a truth i heard him not and that is not an folks are all sleeping
8131-117017-0028.flac,3.995,5.300000000000001,0.0,the kid pocketed the money cheerfully nodding,the kid pocketed the money cheerfully nodding
4350-10919-0015.flac,3.43,5.593,0.143,the family doctor listened attentively and respectfully,the family doctor listen attentively and respectfully
1998-29455-0023.flac,4.715,9.92,0.333,to the elder tramp lies and begging were natural means of livelihood,to the other troubles and begging by natural means of livelihood
8188-269290-0039.flac,2.155,5.787,0.571,marjorie and eileen were close to her,naturally close to her
8280-266249-0059.flac,6.83,12.352,0.471,to elsie's observant eyes it presently became evident that the dalys were in very straitened circumstances,cases observant eyes and presently became evident at the dailies and very straitened circumstances
3538-163622-0012.flac,3.4,9.593,0.545,i am walking about in search of a place said cinderlad,i am talking about a place said the lad
8280-266249-0047.flac,5.88,9.174,0.062,yet there was gambling again the second night between ward and several others of his profession,yet there was gambling again the second night between word and several others of his profession
7018-75788-0002.flac,6.1,9.684000000000001,0.25,hearing this i was sore troubled remembering what i had before suffered from the ape kind,hearing this was so troubled remembering what i had before suffered from the second
367-293981-0010.flac,22.765,54.665,0.409,sancho got up with pain enough in his bones and went after the innkeeper in the dark and meeting the officer who was looking to see what had become of his enemy he said to him senor whoever you are do us the favour and kindness to give us a little rosemary oil salt and wine for it is wanted to cure one of the best knights errant on earth who lies on yonder bed wounded by the hands of the enchanted moor that is in this inn,so i got paid enough in his boat and went after the incident in the dark in meeting the officer who was looking to see what had become of his enemies he said to him senora whoever you are due to favour decides to give us a little rusty oil salted water for it is water out of my best knights and others who lives in yonder bed wounded by the heads of the affected more than is indicated
7105-2330-0000.flac,5.475,10.161,0.462,unfortunately there could be no doubt or misconception as to platterbaff's guilt,unfortunately there could be no doubt a misconception ass the father was killed
8131-117029-0002.flac,2.955,5.403,0.333,only gordon and sheila were left,only gordon and she left
3528-168669-0009.flac,2.12,3.5380000000000003,0.0,a woman is never a man,a woman is never a man
4852-28330-0018.flac,6.685,13.203999999999999,0.32,he then went on to describe what else was to follow the covering of the ship with leaves to make it blend with its surroundings,he then went on to describe what else has to follow the covering a ship with the us to make a plan with the surroundings
8188-274364-0011.flac,8.91,19.067,0.615,your majesty having tried the affections of your people you are absolved and loose from all rules of government and may do what power will admit,you may have tried the actions of your people you observed at local government and they do what parliament
5442-41168-0025.flac,3.15,5.575,0.25,they were to proceed immediately to the election,not to proceed immediately to the election
8461-278226-0000.flac,3.015,5.974,0.857,and laura had her own pet plans,and later on that plane
7975-280076-0027.flac,14.0550625,27.95,0.16,i had not heard of that when i wrote the letter of eighteen seventy four and to correct any misapprehension that might be created by omitting it i will say that at that time i was at neosho kansas with a drove of cattle which i sold to major ray,i have not heard of that when i wrote the letter of eighteen seventy four and to correct any misapprehension that might be created by meeting it i'll say that at the time i was at those cases with a drove of cattle which are sold to majority
1998-29455-0035.flac,5.86,14.575,0.542,if any one arsts you if you ever see im you never set eyes on im in all your born not to remember im,if anyone asks you if you ever see him you never reasonable not to remember
533-1066-0010.flac,6.78,13.285,0.1,put on heavy shoes and some old dark clothes and make up your mind not to be surprised at anything,put it on heavy shoes and some old clothes and make up your mind not to be surprised at anything
8188-269290-0045.flac,4.855,11.177,0.231,the world says no i am not but god says yes you are,the world is now i'm not but god says if you are
5442-41169-0008.flac,2.79,4.9670000000000005,0.167,why what is there to understand,why what is it to understand
533-131556-0023.flac,4.725,10.364,0.688,i would not for much that she should know the infamy and disgrace of her relation,i will not for such another in disgrace a relation
3331-159605-0010.flac,9.15,21.599,0.333,it was that indescribable something which women are quick to see and feel in men who have been blessed with wise and good mothers,it was the indescribable something which women are quick to see and feel men who have been best lies in another
3528-168669-0057.flac,8.445,14.606,0.174,father fauvent mother crucifixion will be interred in the coffin in which she has slept for the last twenty years that is just,father and mother position will be entered in the coffin in which she had slept for the last twenty years that is just
8280-266249-0024.flac,6.555,14.997,0.524,for ye are bought with a price therefore glorify god in your body and in your spirit which are god's,for our part with the prices therefore going on in your body and your spirit which her guards
6070-86744-0021.flac,3.54,8.286,0.333,why really the thing seems to me simple enough,why are the things seems to me the simple enough
8188-269288-0030.flac,12.015,21.088,0.119,leslie went to the window and flung it open she put her head out and tried to peer into the darkness but the moon had already set and she could not see more than a couple of yards in front of her,lastly went to the window and flung it open she put her head out and tried to appear into the darkness but the moon had already said that he could not see more than a couple of yards in front of her
1998-29454-0011.flac,8.585,18.698,0.281,when it was over the man asked dickie if he could walk a little way and when dickie said he could they set out in the most friendly way side by side,when it was over the monastic if he could walk away andy said he could they set out in the most friendly way side by side
8188-269290-0031.flac,2.235,4.198,0.5,do come annie do,to come and do
5764-299665-0012.flac,9.3,20.949,0.45,how can we account for the wild beasts that devour human beings for the fanged serpents whose bite is death,how can we account for the ideas that the for human beings for the faces who it is tat
3005-163391-0003.flac,3.885,7.9879999999999995,0.182,jim cleaned up the canoe and i got my paddle ready,jim cleaned up the canoe and i got my already
2414-159411-0012.flac,3.51,7.396000000000001,0.1,is it fair that he should do so or not,is it fair that they should do so or not
8461-281231-0030.flac,16.69,30.757,0.409,the templar is fled said de bracy in answer to the prince's eager questions front de boeuf you will never see more and he added in a low and emphatic tone richard is in england i have seen him and spoken with him,the timber island said the boy answered the princess the questions from the bath you will never see more and she added in a low and emphatic tone which it is in england i have seen and spoken with him
6432-63723-0053.flac,7.81,18.325,0.192,there was a rattle of coins on the mahogany bar as king sought to disentangle a single bill from the wadded up currency in his pocket,there was a rattle of coins on the mahogany bars king sought to disentangle a single ball from the water a currency in his pocket
3997-180294-0010.flac,8.63,19.916999999999998,0.429,with them the body has worn out the soul the senses have burned up the heart dissipation has blunted the feelings,within the body has worn out the soil is half burned up the heart is patient has blighted the feelings
3538-163619-0014.flac,8.74,20.566000000000003,0.172,no one can tell how delighted the king was to get rid of that hideous bushy bride and get a queen who was bright and beautiful as day itself,no one can tell how delighted the king was to get rid of this hideous ass bright and get a queen it was bright and beautiful day itself
1688-142285-0060.flac,9.78,14.866,0.037,but surely said margaret facing round you believe in what i said that god gave her life and ordered what kind of life it was to be,but surely said margaret facing round you believe in what i said tat god gave her life and ordered what kind of life it was to be
3997-182399-0004.flac,5.3,12.567,0.2,please mister buzzard please tell us the story he begged,please mister please please tell us the story he has
3331-159605-0002.flac,6.23,13.916,0.278,i ve tried it and liked it and maybe this is the consequence of that night's fun,i tried it and licked it and maybe this is a consequence of that night
3080-5032-0008.flac,9.01,20.242,0.364,tis a strange change and i am very sorry for it but i'll swear i know not how to help it,this strengthens and say sorry for it but i swear i know not how to help it
3997-180294-0030.flac,2.715,4.801,0.333,where at home,where is home
7902-96592-0023.flac,2.7,5.675000000000001,0.333,won't do said ram quickly i know you,will do so and quickly i know you
4852-28330-0000.flac,2.4,4.047,0.143,they went down to their quarters first,they went down to the quarters first
7902-96594-0016.flac,1.885,3.1479999999999997,0.0,yes sir of course,yes sir of course
4198-12259-0038.flac,4.935,10.203999999999999,0.667,i'faith pure greek greek o the fine white wine,i therefore agree with all the fine white why
4198-12259-0019.flac,3.34,5.835,0.667,and i sicut terra sine aqua,and i catasauqua
5764-299665-0055.flac,7.98,18.131,0.316,let me refer to just one fact showing the influence of a belief in the bible on human beings,let me refer to just one fact showing evidence of a believing about on human beings
1998-29454-0023.flac,7.91,17.312,0.348,the man's manner was so kind and hearty the whole adventure was so wonderful and new is it country where you going,the man s manner was so kind and thirty adventure so wonderful a year is a country where you going
8188-269290-0047.flac,5.57,8.189,0.214,for all who sin all who suffer you are to a certain extent responsible,for all those who suffer you are to a certain extent responsible
8461-281231-0028.flac,8.24,17.682,0.3,during all this time isaac of york sat mournfully apart grieving for the loss of his dearly loved daughter rebecca,during all this time isabel said mournfully apart grieving for the loss of his daily life daughter rebecca
7902-96595-0001.flac,2.74,6.965999999999999,0.25,mister raystoke sir don't be a fool,mister preston so don't be a fool
7105-2340-0026.flac,13.095,33.612,0.351,i should have given it to you last night after dinner only it happened to be a cream jug and you seemed annoyed at having so many duplicates so i felt rather awkward about giving you another,i should have given it last night after dinner on tat happened to be a green jobs and he seemed nice having so many applicants so i felt rather awkward by another
6432-63723-0005.flac,2.25,3.698,0.0,well i don't know that you can,well i don't know that you can
8131-117016-0056.flac,4.43,6.512,0.091,because izzy is always honest according to how he sees it,because it is always honest according to how he sees it
2414-128291-0002.flac,18.06,51.167,0.667,when however zarathustra was quite nigh unto them then did he hear plainly that a human voice spake in the midst of the kine and apparently all of them had turned their heads towards the speaker,when however it is tat was quite new to this and i hope the human voice speak in areas of the kind and if any one of them had their hands towards peace
5484-24318-0018.flac,5.025,10.835,0.0,in spite of his deep mental distress he could have shouted aloud in his delight and gratitude,in spite of his deep mental distress he could have shouted aloud in his delight and gratitude
8188-269290-0017.flac,4.02,8.593,0.286,as she walked down the corridor she heard it being turned in the lock,and she was in the garden she heard it being turned in the lock
2033-164914-0011.flac,8.945,17.173000000000002,0.273,but take these hundred diners and give them to the singer and bring him to me gently and do him no hurt,take these hundred genes and give them to the singer and bring him to me gently to him not
3528-168669-0039.flac,7.3449375,14.344,0.167,at nine o'clock in the morning and at all hours praised and adored be the most holy sacrament of the altar said the prioress,at nine o clock in the morning and at all hours praised and to be the most holy sacrament of the altar said the prince
5442-41169-0012.flac,3.6,8.120000000000001,0.417,and then to tell the truth there's one's own interests,and then to delete this one's own interests
7902-96594-0007.flac,4.23,13.370000000000001,0.591,you don't think mister gurr that they would dare to injure him if he was so unlucky as to be caught,i think mister they were large and he was so as to be good
3005-163390-0018.flac,5.46,11.043,0.25,well henry he takes a notion he wants to get up some trouble with this country,well here take a notion he wanted to get up some trouble with this country
1998-29454-0046.flac,3.275,4.361000000000001,0.125,well you'll know all about it presently,well you know all about it presently
3997-182399-0017.flac,3.44,9.547,0.9,they like to choke that no count buzzard to death,i like others have not completed
3528-168669-0053.flac,1.77,2.5060000000000002,1.0,yes reverend mother,yet another
6070-86744-0028.flac,8.35,19.012,0.273,well said franz with a sigh do as you please my dear viscount for your arguments are beyond my powers of refutation,well said franz with as i do as you please my dear count for your arguments in my powers of reputation
5764-299665-0025.flac,2.405,5.803,0.5,what is this power,what is that
3528-168669-0011.flac,5.61,11.812,0.562,merit consists in working according to one's strength a cloister is not a dock yard,my cousin working according to un strength a closer is not accurate
6070-86745-0003.flac,7.55,18.443,0.238,wait then during the day tell rosa that when i leave the opera i will sup with her as she wishes,wait then during the day closer when i leave the opera i will sit with her as he wishes
8188-269290-0033.flac,8.71,18.972,0.333,but marjorie and eileen had already departed and leslie and jane found themselves among the last students to arrive at the great east hall,but marylin had already departed and lively and jane found himself among the last to arrive at the great eastward
3538-163622-0008.flac,6.95,19.16,0.4,the youth liked the thought of this let the foals run where they chose and seated himself in the cleft of the rock by the side of the old hag,but like the thought of this little wholesomely concealed himself in the cleft of the rock by the side of the old hag
3764-168670-0054.flac,5.69,15.268,0.765,the hearse halts the undertaker's men knot a rope around your coffin and lower you down,that holds the undertakers another operating coffin and lie down
