filename,length(sec),proc_time(sec),wer,actual_text,processed_text
8461-281231-0002.flac,9.47,19.355,0.222,as he lay upon his bed racked with pain and mental agony and filled with the fear of rapidly approaching death he heard a voice address him,i lay upon his bed rock with pain mental agony and filled with the fear of rapidly approaching death he heard a voice addressing
1998-15444-0022.flac,6.2050625,14.197000000000001,0.429,evaporate the filtrate to a syrup and extract with successive portions of absolute alcohol,every offered to asylum and extract with successive portions of absolute core
7902-96592-0021.flac,2.005,4.849,0.833,won't do said ram grinning,well do something
1998-29455-0027.flac,17.02,35.482,0.377,the new game of begging and inventing stories to interest the people from whom it was worth while to beg went on gaily day by day and week by week and dickie by constant practice grew so clever at taking his part in the acting that mister beale was quite dazed with admiration,then you came begging and inventing stories to interest the people for whom it was possible to pick one day day and week by week and in the constant practice grew so clever taking his pardon acting that mister bell was quite days with admiration
6432-63722-0014.flac,3.84,8.068,0.5,busted his head in with a heavy candlestick one of a pair,but his head and with a heavy candlestick appear
3005-163390-0026.flac,3.075,4.528,0.182,it don't seem natural but i reckon it's so,that don't seem natural but i reckon it so
8188-269290-0005.flac,2.49,4.47,0.5,it burned as if with fever,it but as a fever
4198-12281-0009.flac,18.545,39.008,0.465,to others again he unjointed the spondyles or knuckles of the neck disfigured their chaps gashed their faces made their cheeks hang flapping on their chin and so swinged and balammed them that they fell down before him like hay before a mower,to others again enjoyed defines a nucleus of the neck this figure that checks at their faces made their cheeks and flapping on there and so sweet and bland than that they fell down before him like before him more
6128-63241-0009.flac,5.865,14.468,0.786,olive had a fear of everything but her greatest fear was of being afraid,is that everything that has gone there was a bit afraid
7018-75789-0001.flac,25.39,44.714,0.221,then sighing for myself i set to work collecting a number of pieces of chinese and comorin aloes wood and i bound them together with ropes from the wreckage then i chose out from the broken up ships straight planks of even size and fixed them firmly upon the aloes wood making me a boat raft a little narrower than the channel of the stream and i tied it tightly and firmly as though it were nailed,then sign for myself i said to work correcting a number of pieces of chinese and comrade oswald and he bound them together with rods from the wreckage then i chose out from the broken up ship straight planks of even size and fixed firmly upon the allies would making me about what a little narrower than the channel of a stream and i tied it tightly in firmly as though it were nailed
8188-269290-0001.flac,6.5,12.611,0.45,immediately after dinner that evening leslie ran up to her room to make preparations for her visit to east hall,immediately after the evening little ran up to her and to make preparations for seattle
3538-163619-0012.flac,4.3,5.723,0.091,i shall come twice more and then never again said she,i shall come twice more and they never again said she
7975-280084-0000.flac,3.79,7.99,0.5,i urged on the boys that whatever happened we should not shoot any one,first on the boys at whatever happens we should not see anyone
3538-163624-0013.flac,4.295,8.394,0.188,sigurd said i would touch none of it if by losing it i should never die,that said i would touch none of it for losing it i should never die
3080-5040-0029.flac,13.0,24.8,0.395,he has one son and tis the finest boy that e'er you saw and has a noble spirit but yet stands in that awe of his father that one word from him is as much as twenty whippings,he has one and it is the finest border you saw it as a noble spirit as it stands and that of his father tat one word from him is as much as twenty four things
2609-169640-0009.flac,7.255,18.339,0.381,as our sheets were all flying forward and remained so for a few minutes it gave me leisure to look about,as if it were a thing forward and remained so for a few minutes he gave me anything about
3528-168669-0033.flac,2.445,4.031,0.333,hey more often,the more often
3331-159605-0034.flac,2.035,3.2439999999999998,0.8,perhaps she ll jilt him,perhaps our children
2033-164914-0016.flac,16.925,35.397,0.378,so go thou to thy station and if thou again meet any one after this hour reciting aught of poetry whether he be near or far it will be i or some one i know and thou shalt not learn of him but by me,so go to the station and if you can meet anyone after this arising out of poetry whether this or that it will be i or someone i know and you shall not learn of him but by me
5442-41169-0030.flac,7.7,19.654,0.524,there's the peasants too i wonder at them sometimes any good peasant tries to take all the land he can,there's the peasants stop i wondered at them sometimes in a good position to take on many counts
2414-159411-0016.flac,12.48,30.802,0.607,the brahman stated the case and the eagle answered whenever men see me they try to shoot me they climb the rocks and steal away my little ones,the branches of the case and then answered many women come he tried to shoot me declined the rocks and stipulations
3997-180294-0012.flac,19.035,41.271,0.283,when a creature who has all her past to reproach herself with is taken all at once by a profound sincere irresistible love of which she had never felt herself capable when she has confessed her love how absolutely the man whom she loves dominates her,when a creature who is all hopes to reproach herself with it in all at once i propose irresistible love of which she had never felt herself capable when she has confessed her love how absolutely the man she loved another
4350-9170-0054.flac,5.45,10.766000000000002,0.6,the government they tell us with its army is necessary to defend us from neighboring states who might enslave us,the government itself with its army is necessary defence neighbouring states his labors
4198-12259-0020.flac,3.37,7.416,0.667,give me a synonymon for a gammon of bacon,give me a sonofagun began
7975-280084-0003.flac,6.865,18.026,0.385,j s allen whose hardware store was near tried to go into the bank but miller ordered him away and he ran around the corner shouting,ireland whose heart was always near to go into the back the miller ordered him away and he ran round the corner shouting
3080-5032-0014.flac,3.28,5.852,0.143,but besides i can give you others,but besides i can't give you others
1998-29455-0002.flac,3.89,7.878,0.188,tell yer what mate looks to me as if i'd took a fancy to you,tell you what it looks to me as if i took a fancy to you
4198-12259-0043.flac,3.51,6.800000000000001,0.75,clear off neat supernaculum,clear of the secular
2033-164914-0015.flac,13.67,25.357,0.235,now when the fireman heard these words he feared for zau al makan and wept with exceeding weeping and said to the eunuch by allah it was not i and i know him not,now when the man heard these words he feared for talking and wept with exceeding weeping and said to the union by allah it was nothing and they know him not
2414-159411-0014.flac,10.16,28.907,0.769,three out of the six had given judgment against the brahman but still he did not lose all hope and determined to ask the other three,three out of the six and contentment of austerity measures to the people and into posterity
1998-15444-0020.flac,9.42,17.23,0.476,the residue may be set aside for the detection of the metallic poisons if suspected expel the alcohol by careful evaporation,the other you may be set aside for the detection of the attractions of suspected expired a careful operation
3764-168670-0049.flac,8.29,13.489,0.263,the over prudent cats as they are and because they are cats sometimes incur more danger than the audacious,the over prudent costs as they are and because there can sometimes become more danger than the audacious
6432-63722-0042.flac,2.175,3.918,0.286,some one out here to see you,someone out here to see you
4350-9170-0041.flac,8.465,13.401,0.259,but the fatal significance of universal military service as the manifestation of the contradiction inherent in the social conception of life is not only apparent in that,but the personification universal military service as a manifestation of the contradictions inherent in such a conception of life is not only apparent in that
8188-269288-0001.flac,4.575,8.123,0.455,leslie determined to try for honors in english language and literature,lastly determined to triple the english language and literature
7975-280057-0008.flac,7.645,17.431,0.385,missus washington wells and her son samuel on the road home from kansas city to lee's summit recognized the body as that of my father,miss washington was anderson samuel on the road home from kansas city to the summit recognised the bodies that of my father
5484-24317-0015.flac,8.155,14.468,0.261,his son had been this royal dame's first husband and she had deserted him to marry lysimachus the aged king of thrace,his son had been a royal dames first husband and she had deserted him to marry tat makes the aged king of france
7902-96594-0013.flac,1.925,3.633,0.333,very ill advised thing to do,very last thing to do
8131-117016-0043.flac,5.565,9.129999999999999,0.364,no the cops they're giving me we're covered gordon,no the cops are giving men were covered gordon
4350-9170-0028.flac,10.485,17.430999999999997,0.238,but there is not only one government there are other governments exploiting their subjects by violence in the same way and always ready to pounce down on any other government and carry off the fruits of the toil of its enslaved subjects,but there is not only one of the other governments exporting their such as by violence in the same way and are always ready to cast down on any other government and carry off the fruit of the toil of its slave subjects
2033-164915-0012.flac,6.48,13.062999999999999,0.308,then the eunuch cried upon the pages saying take him off the ass,then the cry upon the pages saying take me off ass
7018-75789-0027.flac,16.74,26.497,0.174,so having made up my mind i packed up in bales a quantity of precious stuffs suited for sea trade and repaired with them from baghdad city to bassorah town where i found a ship ready for sea and in her a company of considerable merchants,so having made up my mind i picked up in bales a quantity of precious stuffs suited for cried and repaired with them from baghdad city to be certain when i found a ship ready for sea and in her accompany of considerable merchants
8131-117017-0005.flac,1.86,2.423,0.0,you can't do it to me,you can't do it to me
6128-63240-0019.flac,4.865,12.877,0.235,and missus luna added that now she was back she didn't know what she should do,and missus miller added that it was back she didn't know what we should do
3997-180294-0011.flac,3.315,5.968,0.125,they love by profession and not by instinct,they loved by profession and not by instinct
8131-117017-0023.flac,3.035,4.6530000000000005,0.222,huh izzy turned it over and shook his head,ass he turned it over and shook his head
3331-159609-0016.flac,2.89,6.103,0.0,said fanny turning hopeful all at once,said fanny turning hopeful all at once
3538-142836-0012.flac,9.535,26.287,0.516,they should be dried in the stove or oven on a sieve and turned every six or eight hours fresh powdered sugar being sifted over them every time they are turned,it should be given the stove or away and turned over six or eight hours but particularly support over them every time their time
3331-159609-0013.flac,2.935,8.187,0.6,it was so stupid of me not to guess before,it was a good one to cut before
5484-24317-0008.flac,7.205,10.063,0.0,then he went directly to the neighbouring palace the queen might have appeared already and it would not do to keep her waiting,then he went directly to the neighbouring palace the queen might have appeared already and it would not do to keep her waiting
3997-180297-0011.flac,4.195,12.104,0.3,well good heavens the means were easy enough to guess,well good heavens themes are easy enough to guess
4350-9170-0048.flac,9.79,17.471,0.2,so that the justification of state violence on the ground of the protection it gives us from evil disposed persons even if it had some foundation three or four centuries ago has none whatever now,so that the justification of state violence on the ground of the protection and gives us from evil spokespersons even if i had some foundation three or four centuries ago has none would ever know
3005-163391-0007.flac,5.55,12.343,0.5,the young chap was mighty thankful said it was tough work toting his baggage such weather,the young cat was mighty thankful tat i was to be worked out in his baggage such weather
2414-159411-0030.flac,3.175,8.246,0.667,shut and bolted said the brahman,shit about it said the game
5442-41169-0013.flac,4.12,9.488999999999999,0.273,they're proprietors of a sort but we're the landowners,the proprietors of the sort but we are the landowners
1688-142285-0006.flac,8.14,10.807,0.08,i don't think mister hale you have done quite right in introducing such a person to us without telling us what he had been,i dont think mister hale you have done quite right in introducing such a person to us without telling us what he had been
3528-168669-0085.flac,3.525,6.831,0.2,no one doubts the right of the monastery to sepulture,no one doubts the right of the misery to culture
4294-9934-0010.flac,2.98,3.527,0.2,they soon elbowed him abruptly,they soon about him abruptly
4294-35475-0007.flac,6.425,12.354000000000001,0.45,thou shalt have thy liberty he cried even though thou shouldst rend me in pieces the moment thou art free,thou shalt have thy liberty cried even though thousands remain pieces the moment thirty
2609-156975-0034.flac,10.69,23.448999999999998,0.231,the cruel fate of his people and the painful experience in egypt that had driven him into the wilderness prepared his mind to receive this training,their cruel fate of these people and the painful experiences and maybe that had driven him into the one prepared his mind to receive this training
4198-12281-0000.flac,18.735,27.358999999999998,0.114,although the plague was there in the most part of all the houses they nevertheless entered everywhere then plundered and carried away all that was within and yet for all this not one of them took any hurt which is a most wonderful case,although the plague was there in the most part of all the houses they nevertheless entered everywhere including in carried away all that was within and yet for all this not one of them took any heart which is a most wonderful feats
8131-117029-0011.flac,10.9,26.424999999999997,0.703,guess a man gets used to anything hell maybe i can hire some bums to sit around and whoop it up when the ships come in and bill this as a real old martian den of sin,can get used to anything that may be is but sit around and looked upon the ship's comin and though this is a real merchandising
4198-12259-0036.flac,2.9,5.968,0.8,white wine here wine boys,why why why boys
8131-117017-0025.flac,4.32,7.748,0.273,for a second izzy's face went blank then he chuckled,for a second as his face went back then he chuckled
4350-10919-0017.flac,2.31,5.497,0.375,and then the mother wishes it he added,and then the other wishes it
6432-63722-0052.flac,4.25,8.788,0.375,if you'll excuse me i'll pretend i'm fishing and i may catch something,if you excuse me pretend to fishing and i may get something
4852-28312-0000.flac,8.685,21.912,0.613,of the many times he had examined mister wicker's window and pored over the rope the ship and the nubian boy he had never gone into mister wicker's shop,of the many times examine mister personal input over the other ship in the human body it never got into mister sharp
3005-163391-0020.flac,2.425,4.062,0.2,was peter wilks well off,was peter was well off
3005-163399-0023.flac,3.365,7.523999999999999,0.083,he must a come and you've missed him along the road,he must come and you have missed him along the road
3764-168671-0018.flac,2.04,4.143000000000001,0.4,he played with father mestienne,he played with further mission
7975-280085-0013.flac,6.92,16.242,0.379,there is no use stopping to pick up a comrade here for we can't get him through the line just charge them and make it if we can,there is no use stopping to pick up a comrade who we can't get him to users and make it again
1998-29454-0031.flac,2.74,5.836,0.2,they could put a man away for less than that,they could put him away for less than that
533-131564-0021.flac,4.4,6.463,0.0,god help me then for i'm sure i need it,god help me then for i am sure i need it
1998-15444-0023.flac,3.465,6.401000000000001,0.667,separate the ethereal solution and evaporate,separate the resolution and the report
4294-9934-0028.flac,11.35,23.123,0.389,marius sent back the thirty louis to his aunt with a respectful letter in which he stated that he had sufficient means of subsistence and that he should be able thenceforth to supply all his needs,mary come back the thirty thousand but the respectful letter in which he stated that he has sufficient means of subsistence and tat he should be able by force supply on his knees
1688-142285-0083.flac,4.21,6.713,0.0,what would you do papa how would you set about it,what would you do papa how would you set about it
7105-2330-0028.flac,7.25,16.994,0.389,eight o'clock struck the crowd outside chanted with an increasing volume of sound will vote the other way,a clock struck the ground as a chance an increasing volume of sound the vote the other way
4852-28311-0022.flac,12.525,26.568,0.2,on the left the coil of rope in the center the model of a sailing ship in a green glass bottle and on the right the wooden statue of a negro boy in baggy trousers turkish jacket and white turban,on the left the coil of rope in the center of the model of a sailing ship in a green glass bottles and on the right the wooden status of the negro boy my trousers of his jacket and white turban
1688-142285-0052.flac,7.08,12.299,0.125,as they turned up into a small court opening out of a squalid street bessy said,ass they turned up into a small court opening out into a squalid street bessy said
3528-168669-0124.flac,2.96,6.043,0.3,what is to be done with that coffin father fauvent,what is to be done with the coffin forever
4294-14317-0012.flac,11.155,23.032,0.219,when he had heard this speech the duke rose up in anger and sent for bernardone who was forced to take flight as far as venice he and antonio landi with him,when he had heard this speech the duke rose up and anger and sent for anyone who is forced to take flight as far as banks internal and with him
4198-12281-0007.flac,11.79,21.563000000000002,0.407,wherefore is it that our devotions were instituted to be short in the time of harvest and vintage and long in the advent and all the winter,therefore is it that devotions were instituted to be shot in the time of harvest invented along in advance in the winter
6432-63723-0012.flac,4.005,7.659,0.0,she said he had struck her more than once and she could stand it no longer,she said he had struck her more than once and she could stand it no longer
8280-266249-0026.flac,11.14,19.601,0.276,and again i beseech you therefore brethren by the mercies of god that ye present your bodies a living sacrifice holy acceptable unto god which is your reasonable service,and again i beg you therefore brethren by the mercy of god that you present your bodies loving sacrifice wholly acceptable and which is your reasonable service
7902-96591-0005.flac,3.425,6.258,0.154,he could not help it he hates the smugglers you shall not tell,he could not help it he had the smokers you shall not tell
6938-70848-0025.flac,2.24,4.15,0.167,he spoke to the rump convention,he spoke to the un convention
4852-28311-0000.flac,2.025,4.517,0.25,say you know sumthin,say you know something
1998-15444-0012.flac,7.865,13.744,0.136,the tube should be examined to see that it is not broken or cracked as accidents have happened from neglecting this precaution,the eu should be examined to see that it is not broken a correct as accidents have happened from neglecting this precaution
533-131556-0019.flac,15.22,35.219,0.526,if you are generous here is a fitting opportunity for the exercise of your magnanimity if you are proud here am i your rival ready to acknowledge myself your debtor for an act of the most noble forbearance,if your generous she was feeling opportunity for the exercise of humanity if you are proud where am i arrival recitals myself adapter for active most noble forbearance
3764-168671-0035.flac,3.0,6.587,0.444,the grave digger walked on in front of him,the granting of water in front of him
367-293981-0012.flac,8.11,17.297,0.5,sancho panza who also regarded the amendment of his master as miraculous begged him to give him what was left in the pigskin which was no small quantity,such a person whose regard the amendment of his master s miraculous begged him to give a setting a pension which is no small quantity
4350-9170-0025.flac,17.13,31.168,0.274,the reason to which he gave expression is essentially the same as that which made the french kings and the popes engage swiss and scotch guards and makes the russian authorities of to day so carefully distribute the recruits so that the regiments from the frontiers are stationed in central districts and the regiments from the center are stationed on the frontiers,the reason to which he gave expression essentially the same as that which made the french king in the pope's engaged swift and scotch guards and makes the russian authorities of the day so carefully distribute reports so that the regiments from the sentinel stationed in central districts and regions from the central station on the frontiers
5484-24317-0026.flac,2.96,4.806,0.429,hermon listened to the pair in silence,having listened to the parent silence
5764-299665-0029.flac,6.97,17.204,0.467,a child charmed by the beauty of the flame grasps it with its dimpled hand,a child ashamed by the beauty of the same grasped with both hands
7018-75788-0018.flac,20.84,34.434,0.082,each that died we washed and shrouded in some of the clothes and linen cast ashore by the tides and after a little the rest of my fellows perished one by one till i had buried the last of the party and abode alone on the island with but a little provision left i who was wont to have so much,each that did we washed and shrouded in some of the clothes and live cast ashore by the times and after a little the rest of my fellows perished one by one till i had buried the last of the party and abode alone on the island with but little provision left i was wont to have so much
4350-10919-0005.flac,3.145,7.2700000000000005,0.4,as you please the princess went out with a sigh,as he was the princess with a sigh
4852-28330-0019.flac,5.545,12.022,0.267,camouflage was not a word the captain or anyone else of his time yet understood,the conflict was not a word the captain or anyone else of his time he had understood
3331-159609-0007.flac,5.835,13.09,0.0,i try not to deceive myself but it does seem as if there was a chance of happiness for me,i try not to deceive myself but it does seem as if there was a chance of happiness for me
8131-117016-0050.flac,2.52,4.281,0.0,ever see a martian election,ever see a martian election
3331-159609-0015.flac,6.805,14.452,0.5,i hope maria bailey is all he thinks her she added softly for i could n't bear to have him disappointed again,i hope mobiles are things chattered softly i could not bear to have disappointed again
8188-269288-0053.flac,6.065,10.712,0.211,annie did not mean to confide in anyone that night and the kindest thing was to leave her alone,and he did not mean to convince anyone that night and the kindest thing was to leave her alone
8131-117016-0039.flac,5.545,9.252,0.167,murdoch sent one of the men to pick up a second squad of six and then a third,mary said one of the men to pick up a second square of six and then a third
7105-2340-0037.flac,6.535,11.798,0.125,brave little woman said peter with a gasp of relief i could never have done it,the little woman said peter with a gasp of relief i could never have done
7105-2340-0005.flac,23.01,59.212,0.5,a wilfrid pigeoncote had covered himself with honours in the course of marlborough's campaigns and the name wilfrid had been a baptismal weakness in the family ever since the new heir to the family dignity and estates was a young man of about five and twenty who was known more by reputation than by person to a wide circle of cousins and kinsfolk,alfred began tat had covered himself an honors in the course of various companies in the name of it had been at this weakness in the family ever since then you are the family dignity as this was a young man of about five and twenty thousand more by reputation and my personality gloves and comfort
3331-159605-0020.flac,14.975,34.655,0.204,how he got there was never very clear to polly but there he was flushed and a little out of breath but looking so glad to see her that she had n't the heart to be stiff and cool as she had fully intended to be when they met,how he got there was never very clear to many but there was flushed a little out of it but looking so glad to see her tat he had not the heart to be stiff and cold and she had fully intended to them they met
6128-63241-0003.flac,8.36,17.622999999999998,0.348,he was sorry for her but he saw in a flash that no one could help her that was what made her tragic,he was sorry for what he saw in the fact that no one could have that was what made him credit
