filename,length(sec),proc_time(sec),wer,actual_text,processed_text
3331-159605-0012.flac,7.42,24.218,0.579,lately this had changed especially towards polly and it flattered her more than she would confess even to herself,sadly that has changed especially towards police and another to confess even to herself
3538-163624-0026.flac,6.375,11.165000000000001,0.08,not long to wait he said till the bitter sword stands fast in my heart and thou will not live long when i am dead,not long to wait he said to the bitter sword stands fast in my heart and i will not live long when i am dead
4198-12259-0032.flac,11.63,27.007,0.667,let us wind our horns by the sound of flagons and bottles and cry aloud that whoever hath lost his thirst come not hither to seek it,that is why and by the sound of wagons and battles and cried aloud tat we have lost as those combating it
4350-9170-0032.flac,8.71,13.609000000000002,0.214,the despotism of a government always increases with the strength of the army and its external successes and the aggressiveness of a government increases with its internal despotism,the despotism of the government always increases with the strength of the army and sectoral successes and the business of the governments increases with its internal despotism
8188-269288-0033.flac,7.4,14.806000000000001,0.35,leslie left the room but she had scarcely gone a dozen paces down the corridor before she met annie returning,this they left the room but she had scarcely got a dozen paces down the girl before you make any returning
3997-180297-0008.flac,6.35,11.501000000000001,0.0,if there were any other i would tell you for we are not to have any secrets from one another now,if there were any other i would tell you for we are not to have any secrets from one another now
5764-299665-0035.flac,5.13,11.29,0.545,they are regarded as good that is to say as moral,they are regarded as good but these small
3764-168670-0047.flac,4.26,7.487,0.333,a man who is making his escape does not cough or sneeze,a man who was making his escape does not cover smes
4198-61336-0016.flac,12.92,30.666999999999998,0.219,no resistance was possible on the part of menahem the usurper who was probably ready to welcome the assyrian conqueror so that by arranging an alliance he might secure his own position,no resistance was possible import of many the usurper who probably ready to welcome the syrian conquer so that by arranging an alliance he might secure his own position
3005-163399-0002.flac,3.475,6.912,0.556,i out with a yes'm before i thought,it was a yes for i thought
5484-24318-0031.flac,3.32,8.627,0.667,on the way his heart throbbed almost to bursting,on the way they dropped upon most birthday
4852-28319-0023.flac,9.965,19.697000000000003,0.095,mister wicker began moving about upstairs the floorboards creaked and still chris could not leave until the potion fumed and glowed,mister wicker began moving about upstairs the forwards patricia and still chris could not leave until the potion fumed and glowed
8280-266249-0004.flac,5.87,11.871,0.059,there are some nice looking people on board remarked mister travilla in an undertone to his wife,there are some nice people on board remarked mister travilla in an undertone to his wife
8280-266249-0035.flac,17.285,37.731,0.36,his victim who had been looking on during the little scene and listening to the mysterious voice in silent wide eyed wonder and fear now rose hastily his face deathly pale with trembling hands gathered up the money he had staked and hurrying into his state room locked himself in,his victim had been looking on doing a little thing and listening to the mysterious voice and silently eyed wonder and fear arose hastily his face deadly pale with trembling hands gazed at the mistakes and her into a state room locked himself in
3538-163624-0020.flac,7.95,22.377000000000002,0.44,there must she sleep till thou comest for her waking rise up and ride for now sure she will swear the vow fearless of breaking,then she sleep till thou comes for her waking rise up and river no curious or the bold fearless of breaking
3005-163390-0008.flac,4.25,8.75,0.364,you bet it is the jedge is right everybody sings out,you made it is the judges right everybody things out
367-293981-0013.flac,7.96,22.078,0.379,don quixote consented and he taking it with both hands in good faith and with a better will gulped down and drained off very little less than his master,don quixote had said and he took it with both hands in good faith and with a better will go to town and a very little lessons master
4294-35475-0002.flac,4.745,10.485,0.25,but the king laughed him to scorn thou a sword he quoth,but the king laughed him to scorn the sword he called
2609-157645-0013.flac,6.23,20.319,0.667,going to church at hayes in those days must have been quite an exciting experience,go to church in those days missing at the conference
533-1066-0009.flac,3.98,5.085999999999999,0.0,something is going to occur he said,something is going to occur he said
8280-266249-0018.flac,7.52,17.819,0.278,that the french polytechnic institute had to prohibit its use on account of its effects on the mind,that the french police institute had to prohibit on account of its use effects upon the mind
3997-182399-0012.flac,5.255,10.478,0.538,it was on a lil ol house a lil ol tumble down house,it was in the old house and the old tumble down house
3538-142836-0019.flac,29.525,80.91099999999999,0.469,in speaking of confectionary it should be remarked that all the various preparations above named come strictly speaking under that head for the various fruits flowers herbs roots and juices which when boiled with sugar were formerly employed in pharmacy as well as for sweetmeats were called confections from the latin word conficere to make up but the term confectionary embraces a very large class indeed of sweet food many kinds of which should not be attempted in the ordinary cuisine,in speaking of confectionery supermarkets that all the operations about not come strictly speaking under that had one of his flowers besides which one was over was formerly employed farmers as well as for sweetwater called conclusions from the land would continue to make up but the term confectionary abuses of large class indeed a sweep of many kinds of which should not be attempted in the ordinary call
8280-266249-0021.flac,7.225,14.504,0.438,and then such powerful acids produce intense irritation and thirst thirst which water does not quench,and then such powerful assets produced intense irritation and first there is which water is not quite
7902-96594-0000.flac,3.0,9.942,1.0,seemed in good spirits last night mister gurr eh,feeling experiences yesterday
8280-266249-0050.flac,7.795,15.511,0.15,an intense voiceless excitement possessed the players for the game was a close one and the stakes were very heavy,an intense voiceless excitement possessed the players for the game was a close and mistakes were very heavy
7975-280063-0011.flac,2.75,8.385,0.556,about nine thirty a m i was shot down,about another team i was shut down
1688-142285-0022.flac,13.865,18.122,0.029,just as she was leaving the room she hesitated she was inclined to make an acknowledgment which she thought would please her father but which to be full and true must include a little annoyance,just ass she was leaving the room she hesitated she was inclined to make an acknowledgment which she thought would please her father but which to be full and true must include a little annoyance
4852-28330-0025.flac,2.625,5.081,0.571,their conversation had taken some little while,their konversation had taken some of the whole
7105-2330-0008.flac,5.255,14.175999999999998,0.25,the jury find the prisoner guilty of blowing up the albert hall,they found the prisoner guilty of blowing up the albert hall
3538-163624-0002.flac,8.14,16.134,0.029,but in the night when the battle was over his young wife came out and searched for him among the slain and at last she found him and asked whether he might be healed,but in the night when the battle was over his young wife came out and search for him among the slain and at last she found him and asked whether he might be healed
3331-159605-0027.flac,4.72,15.653,0.615,asked the artful young man laying a trap into which polly immediately fell,at the time in playing a trip into which can immediately
7105-2330-0003.flac,17.05,44.335,0.302,of course any sentence which the law might feel compelled to inflict would be followed by an immediate pardon but it was highly desirable from the government's point of view that the necessity for such an exercise of clemency should not arise,of course innocent israeli might feel compelled to inflict would be followed by an immediate pardon but is highly desirable from the government in spite of you that the necessity for such an exercise of clemency in this
8280-266249-0002.flac,13.25,30.751,0.405,there were no sad leave takings to mar their pleasure the children were in wild spirits and all seemed cheerful and happy as they sat or stood upon the deck watching the receding shore as the vessel steamed out of the harbor,there are sadly taking to mother pleasure the children of spirits and all seemed cheerful and happy as they sat or stood upon the death watching the receding sure as investing in the harbor
1998-29454-0016.flac,2.46,5.252,0.5,ain't bad when she's in a good temper,and when she saw a good temper
7902-96591-0000.flac,2.095,4.448,0.444,i am from the cutter lying off the coast,and from the carrying off the coast
5484-24317-0023.flac,3.51,5.704000000000001,0.286,that is going too far replied hermon,that is going too far replied the man
6128-63240-0026.flac,5.77,13.736,0.5,i shall be back very late we are going to a theatre party that's why we dine so early,i shall be back very late with the other party that's why don't i
7105-2340-0028.flac,11.685,34.442,0.346,lady ernestine pigeoncote his mother moved in circles which were entirely beyond their compass or ambitions and the son would probably one day be an ambassador,lady earnestly call this mother moves in circles which are entirely in their compass ambitions and the sun would probably one day be ambassador
8131-117016-0009.flac,5.81,8.881,0.059,gordon reported for work with a sense of the bottom falling out mixed with a vague relief,corn reported for work with a sense of the bottom falling out mixed with a vague relief
6128-63240-0017.flac,7.4,19.315,0.15,this last remark he made at a venture for he had naturally not devoted any supposition whatever to missus luna,this last remark he made a venture for he had naturally not devote any supposition whatever to missus la
3331-159605-0025.flac,1.72,2.537,0.0,thank you no,thank you no
3331-159609-0014.flac,28.37,85.647,0.312,it was so tender earnest and defiant that fanny forgot the defence of her own lover in admiration of polly's loyalty to hers for this faithful all absorbing love was a new revelation to fanny who was used to hearing her friends boast of two or three lovers a year and calculate their respective values with almost as much coolness as the young men discussed the fortunes of the girls they wished for but could not afford to marry,it was a tender earnest and i find that very forgot the defence of her love and admiration of publicity to her for this faithful one sobbing love was a new revelation to fanny who was used to hearing your friends post to another and calculate their respective values with almost ass much coolness ass the young man discussed the fortunes of the girls they wished for but could not afford to marry
3997-180294-0024.flac,2.755,6.516,0.0,the boxes filled one after another,the boxes filled one after another
3997-180297-0023.flac,12.89,35.007,0.5,marguerite tired out with this long confession threw herself back on the sofa and to stifle a slight cough put up her handkerchief to her lips and from that to her eyes,mary partiality with his long confession yourself back on the sofa and stifle a slight computer and achieved lips and from that our eyes
3331-159605-0043.flac,7.095,21.504,0.524,he meant to go away before that so don't think his heart is broken or mind what silly tattlers say,he meant to go away before something his heart is broken and tat city tat lucy
8131-117016-0058.flac,5.695,8.758000000000001,0.143,the groups grew more experienced and murdoch was training a new squad every night,the groups grew more experienced and mary was trying a new squad every night
4350-10919-0006.flac,3.55,7.261,0.455,the family doctor respectfully ceased in the middle of his observations,the family doctor respectfully ceased its observations
1998-15444-0011.flac,11.785,24.976999999999997,0.281,in using the elastic stomach tube some fluid should be introduced into the stomach before attempting to empty it or a portion of the mucous membrane may be sucked into the aperture,and using this expenditure some fruit should be introduced into the stomach before attempting to empty it for a portion of the mucous membrane may be expected to the aperture
6938-70848-0008.flac,3.44,10.673,0.818,the peasants are the people of russia wait until the peasants,these people are given to the patient
3997-180297-0030.flac,4.75,9.177,0.273,one has to but he wants more than that what then,one has to put it once more than that what then
5484-24317-0017.flac,16.735,35.074,0.232,we women are only as old as we look and the leeches and tiring women of this beauty of forty practise arts which give her the appearance of twenty five yet perhaps the king values her intellect more than her person and the wisdom of a hundred serpents is certainly united in this woman's head,we women are only as good as we look at the legislative woman of this beauty of forty practices which give the appearance of twenty five is perhaps the key values her intellect more than the person and the wisdom of a hundred serpents certainly united in this woman's head
6070-86744-0017.flac,3.145,6.14,0.286,upon my honor then listen to me,upon my honour and listen to me
7018-75788-0009.flac,3.405,4.649,0.2,when it was the five hundred and fifty ninth night,when it was the five hundred and fifty nine tonight
1998-29454-0005.flac,4.08,9.094,0.182,he had never seen one before and it interested him extremely,he had never seen before and its interested him extremely
4198-12259-0021.flac,4.38,9.66,0.6,it is the compulsory of drinkers it is a pulley,it is a complicated as it is applied
2033-164916-0010.flac,8.16,18.526,0.118,he then repaired to the heart of the encampment and ordered the host to halt ten days,he then repaired to the hearts of the encampment and ordered the host to ten days
4350-9170-0020.flac,7.42,21.267999999999997,0.345,and therefore the oppression of the oppressed always goes on growing up to the furthest limit beyond which it cannot go without killing the goose with the golden eggs,and therefore the expression of the press always goes on growing at the furthest behind which it cannot do that killing the goose with a golden axe
8280-266249-0038.flac,6.385,15.114999999999998,0.273,i wonder which of us it is remarked the first looking hard at our party i don't know but come on,i wonder whether it is remarked the first looking hard at our party i don't know began
3528-168669-0051.flac,3.85,9.578,0.077,fortunately the prioress completely absorbed in her own thoughts did not hear it,fortunately the paris completely absorbed in her own thoughts did not hear it
4350-9170-0057.flac,14.315,31.735,0.13,even looking at it practically weighing that is to say all the burdens laid on him by the state no man can fail to see that for him personally to comply with state demands and serve in the army would in the majority of cases be more disadvantageous than to refuse to do so,even looking at a practically when that is to say all the birds laid on him by the states no man can fail to see that for him personally to comply with a state demands and serve in the army would in the majority of cases being more disadvantages than to refuse to do so
3538-163624-0003.flac,6.465,11.398,0.2,so he asked the queen how do you know in the dark of night whether the hours are wearing to the morning and she said,so he asked the queen how do you know in the dark of night was it the hours away into the morning and she said
3005-163391-0017.flac,4.27,10.659,0.062,old peter had friends and they ain't going to let them come to no harm,oh peter had friends and they ain't going to let them come to no harm
8131-117016-0044.flac,2.85,8.115,0.714,but the stonewall gang is backing wayne,that is emerging is backing away
3331-159605-0036.flac,6.56,21.058,0.522,minnie said the other day she wished she was a pigeon so she could paddle in the puddles and not fuss about rubbers,visit the other day is thus a pigeon so she could prattle on the bottles and others about this
2414-159411-0021.flac,2.49,6.2219999999999995,0.5,now the sixth was a jackal,as it was a jackal
6070-86744-0002.flac,17.315,36.47,0.122,my father the comte de morcerf although of spanish origin possesses considerable influence both at the court of france and madrid and i unhesitatingly place the best services of myself and all to whom my life is dear at your disposal,my father the compromises although of spanish origin possesses considerable influence both at the court of france in madrid and i unhesitatingly place the best services of myself and all to whom my wife's dear at your disposal
6128-63244-0020.flac,17.15,49.916,0.615,this was the only sacred cause this was the great the just revolution it must triumph it must sweep everything before it it must exact from the other the brutal blood stained ravening race the last particle of expiation,this was the only because this was a great test resolution it was and it is something that must expect from the other disabled and made the last party expansion
4852-28311-0014.flac,6.59,16.59,0.4,chris started off once more passing the bleak little victorian church perched on the hill above mister wicker's house,fr started off once more passing oblique little victorian surcharges on the child of mister wicker s house
5764-299665-0006.flac,8.785,22.835,0.35,is he responsible for all the wars that have been waged for all the innocent blood that has been shed,is it responsible for all the walls that have been reached for both in the blood that has been used
7902-96592-0016.flac,2.075,5.271000000000001,0.667,hullo he said who are you,so he said here
3538-163622-0003.flac,2.28,5.271000000000001,0.429,yes that i have said the youth,yes the house said the youth
2414-128292-0013.flac,2.465,6.266,0.286,must i ever be on the way,must never be on the way
3528-168669-0099.flac,3.295,7.747,0.231,you will close the coffin the sisters will carry it to the chapel,we will close the coffin the sisters will carry out the chapel
1998-15444-0003.flac,7.25,13.561,0.235,in making a post mortem examination the alimentary canal should be removed and preserved for further investigation,in making a postmodern examination the elementary that should be removed and preserved for further investigation
2414-128291-0019.flac,6.205,19.836,0.545,they also abstain from all heavy thoughts which inflate the heart,they also asked for a heavy tat the heart
3528-168669-0015.flac,1.985,4.084,0.429,i will put the lever through it,i will put the oversight
5442-41169-0029.flac,5.06,14.123000000000001,0.333,there's a class instinct too of what one ought and oughtn't to do,there's a class instinct to what one ought not now to do
5442-41169-0004.flac,6.45,13.857000000000001,0.0,these persons were unmistakably seeking a place where they could talk without being overheard,these persons were unmistakably seeking a place where they could talk without being overheard
6070-63485-0015.flac,2.13,5.174,0.5,in the plain of saint denis,in the plan of safety
5764-299665-0053.flac,5.06,15.419,0.444,the religion of the puritan was an unadulterated curse,the religion of the puritan was intended to make cuts
2414-128291-0005.flac,10.65,34.108,0.6,for i tell thee that i have already talked half a morning unto them and just now were they about to give me their answer,for italy but i have without hospitality and just now when about to give the answer
8280-266249-0015.flac,13.525,37.071999999999996,0.4,one drop of nicotine extract of tobacco placed on the tongue of a dog will kill him in a minute the hundredth part of a grain picked under the skin of a man's arm will produce nausea and fainting,one drop of nicotine extracted tobacco placed on the tone of the dog will kill him in a minute of the hundred part of the green paper and is a man's arm of producers and fainting
3005-163389-0003.flac,11.66,27.582,0.438,sherburn run his eye slow along the crowd and wherever it struck the people tried a little to out gaze him but they couldn't they dropped their eyes and looked sneaky,carbon units are slowly along the ground and where it struck the people try a little to them but they couldn't they dropped her eyes and looks like
4294-9934-0019.flac,3.45,6.253,0.0,it is badly paid work but one can live by it,it is badly paid work but one can live by it
4294-35475-0010.flac,4.1,12.247,0.929,scissors grow a giant's height and save us from the ogre's might,this region since it might
6070-86744-0013.flac,8.68,16.975,0.034,well since we must part said the count holding out a hand to each of the young men allow me to wish you both a safe and pleasant journey,well since we must part said the count holding out a hand to each of the young man allow me to wish you both a safe and pleasant journey
7902-96592-0042.flac,3.415,6.742,0.615,it was your turn yesterday it's mine to day what a game,it was a ton yesterday is monday what again
8461-281231-0019.flac,12.705,24.392000000000003,0.189,but in other parts the besiegers pursued the defenders of the castle from chamber to chamber and satiated in their blood the vengeance which had long animated them against the soldiers of the tyrant front de boeuf,but in other parts the besiegers pursued the defenders of the castle from chamber to chamber associated in the blood vengeance which had long animated them against the soldiers of the tyrant from above
7975-280076-0025.flac,5.485,10.734,0.429,about the last of december eighteen seventy three i arrived in carroll parish louisiana,about the last december eighteen seventy three arriving covers louisiana
7105-2340-0019.flac,4.73,13.306,0.6,vigilance was not completely crowned with a sense of victory,but this was not completely conveys a victory
8280-266249-0036.flac,2.38,5.749,0.167,what does it mean cried one,what does it mean and one
8461-278226-0015.flac,4.2,10.647,0.714,you will be doing me such a favour philip if you'll say yes,you will become such a favor felicia says
6128-63240-0013.flac,4.63,8.606,0.25,she was attractive and impertinent especially the latter,she was attractive and important especially if the latter
3538-163622-0023.flac,3.545,8.49,0.308,that is a river said the foal and we have to cross it,that is a reason for and we have to cross it
6432-63722-0035.flac,7.03,16.195,0.579,before the big wind in ireland suggested thong with a nod at his irish compatriot slightly laughed the colonel,before the big indian suggested one with another as irish compatriots slightly to have the colonel
3080-5040-0001.flac,12.95,25.802,0.167,my poor lady vavasour is carried to the tower and her great belly could not excuse her because she was acquainted by somebody that there was a plot against the protector and did not discover it,the poor lady vavasor is called a tower and a great belly could not excuse her because she was acquainted by somebody that there was a plot against the protector and did not discover it
7975-280076-0006.flac,3.28,8.761000000000001,0.2,the parts of this letter now relevant are as follows,the parts of this letter are as follows
3538-163624-0001.flac,6.16,15.581,0.045,the old king went out and fought bravely but at last his sword broke and he was wounded and his men fled,the old king went out and fought bravely but at last his sword broke and he was wounded and his men filed
1998-15444-0021.flac,4.785,13.915000000000001,0.417,on the evaporation of the alcohol the resinous and fatty matters separate,on the operation of the icao the business and they made separate
4350-9170-0001.flac,2.06,2.582,0.0,this is absolutely incorrect,this is absolutely incorrect
1688-142285-0046.flac,2.795,5.652,0.143,nought worse than many others i reckon,not worse than many others i reckon
6128-63241-0010.flac,11.68,29.863,0.273,she had erected it into a sort of rule of conduct that whenever she saw a risk she was to take it and she had frequent humiliations at finding herself safe after all,she had erected it into a sort of rules of conduct that whenever she says she was to take it and she had frequent communications and finding herself at once
1688-142285-0009.flac,3.535,4.966,0.0,why it might have been in the workhouse,why it might have been in the workhouse
6938-70848-0006.flac,5.53,16.894000000000002,0.75,who are you a counter revolutionist a provocator they bellowed at him,who are you controls must appreciate the beating
367-130732-0004.flac,5.875,13.782,0.13,a book could be written about this restaurant and then all would not be told for all its secrets can never be known,a book could be written about this restaurant and that would not be sold for all its secrets can never be known
5442-41168-0023.flac,4.78,9.441,0.385,if there are men younger and more deserving than i let them serve,if the women younger and more deserving than i let themselves
7902-96594-0012.flac,2.07,5.31,1.0,no wait another half hour,however
