filename,length(sec),proc_time(sec),wer,actual_text,processed_text
7975-280076-0008.flac,6.16,16.754,0.375,i will give you this outline and sketch of my whereabouts and actions at the time of certain robberies with which i am charged,i will give you the outlines of my whereabouts and actions at the time of certain lobbies with return charge
7975-280076-0014.flac,8.135,18.808,0.357,during the summer i was either in saint clair jackson or kansas but as there was no robbery committed that summer it makes no difference where i was,during the summer i was neither a clear jackson arkansas but as there was no robbery committed this summer that national difference where i was
4198-12259-0028.flac,4.85,9.649000000000001,0.25,o for god's sake let us lash them soundly yet thriftily,oh for god's sake let us last them soundly yet wisely
5442-32873-0018.flac,17.8,44.006,0.383,luke stuck on his greasy wideawake and in a few minutes more the dog cart was trundled out into the lane and the horse harnessed went between the shafts with that wonderful cheerfulness with which they bear to be called up under startling circumstances at unseasonable hours,livestock is crazy whites and in a few minutes more the dugong was tumbled out into the lane and the horse honest went between the shops with a wonderful event with which they are to be voted on the startling circumstances an unseasonable hours
6070-86744-0007.flac,8.655,16.338,0.08,i reside in my father's house but occupy a pavilion at the farther side of the court yard entirely separated from the main building,i reside in my father's house but occupy a pavilion at the farther side of the courtyard entirely separated from the main building
3331-159605-0003.flac,5.575,11.911999999999999,0.357,just suppose it is true that he does ask me and i say yes,but just suppose it is true that he has asked me to say yes
6070-63485-0014.flac,8.04,14.454,0.1,well my wife shall be there said the schoolmaster you will tell her what you want and i shall see,well my wife shall be there said the schoolmaster you will tell her what it wants and i shall see
7902-96591-0012.flac,7.145,12.725,0.161,for it suddenly occurred to him that he was not only a prisoner but a prisoner in the power of a very reckless set of people who would stop at nothing,for it suddenly occurred to him that he was not only a prisoner a prisoner in the power of a very reflective people who will stop at nothing
7902-96595-0008.flac,4.76,13.106000000000002,0.682,if you'd let me finish you'd know said gurr gruffly one of our boys is missing seen him up here,if you let me finish knows and roughly one opposes missing severe
8461-281231-0037.flac,7.33,13.545,0.091,at his feet was placed a table occupied by two scribes whose duty it was to record the proceedings of the day,at his feet was placed the tables occupied by two scribes whose duty it was to record the proceedings of the day
533-1066-0000.flac,2.55,6.314,1.0,when churchyards yawn,one such action
2609-156975-0021.flac,8.32,19.674,0.267,on the borders of the wilderness he found certain bedouin herdsmen who received him hospitably,on the borders of the wilderness he found certain ten percent who received impossible
4350-10919-0001.flac,2.9000625,6.199,0.125,before her he decided to scatter his pearls,before her he decided to scatter his girls
4294-9934-0007.flac,8.705,13.662999999999998,0.143,he feared after having taken so many steps which had brought him nearer to his father to now take a step which should estrange him from that father,he feared after having taken so many steps which had brought him nearer to his father to now take a step which had a strange him from her father
533-131564-0000.flac,2.01,3.88,0.5,vain hope i fear,they hope by fear
367-130732-0001.flac,4.38,8.616999999999999,0.25,when is a lobster not a lobster when it is a crayfish,it is also not a lobster when it is a crayfish
3528-168669-0072.flac,3.125,6.87,0.4,think father fauvent if she were to work miracles here,thankfully even if she were to work miracles there
3997-180294-0002.flac,6.425,15.345,0.182,well do it for me for i swear to you that i don't love you as the others have loved you,well do it for me i swear to you i love you as the others have loved you
4852-28319-0017.flac,2.9200625,5.447,0.0,but how did one change inanimate to animate,but how did one change inanimate to animate
3528-168669-0058.flac,2.605,3.0010000000000003,0.0,it is a continuation of her slumber,it is a continuation of her slumber
3528-168656-0007.flac,5.625,9.465,0.167,thus it furnished a subject of comment for all those who were unoccupied or bored in the convent,thus it furnished a subject of common for all those who were unoccupied forward in the convent
6432-63723-0014.flac,7.11,8.924,0.059,larch by refusing to appear practically admitted the charges against him and did not oppose the separation,large by refusing to appear practically admitted the charges against him and did not oppose the separation
7105-2340-0006.flac,3.0,6.492,0.143,and the reputation was an unpleasant one,and the reputation was an impressive one
7902-96594-0020.flac,5.57,14.373000000000001,0.762,then what did you mean speak out and don't do the double shuffle all over my clean deck no sir,then what do you speak one and one that we should not do so
3005-163390-0028.flac,3.88,6.6610000000000005,0.714,doan you hear me shet de do,don t you hear me shouted
7902-96595-0004.flac,2.36,5.576,1.0,ah ejaculated dick sadly,basically
4198-12281-0010.flac,15.79,34.371,0.657,to some with a smart souse on the epigaster he would make their midriff swag then redoubling the blow gave them such a homepush on the navel that he made their puddings to gush out,to sum up this is one big after you will make the measures we then redoubling the blow in such a whole personal they made their putting to cash out
7018-75789-0007.flac,9.215,16.804000000000002,0.167,when they saw i understood them not and made them no answer one of them came forward and said to me in arabic peace be with thee o my brother,when they saw i understood them not and made no answer one of them came forward and said to me in arabic peace within my brother
4294-32859-0000.flac,6.13,9.689,0.211,wylder was rather surly after the ladies had floated away from the scene and he drank his liquor doggedly,while there was rather silly after the ladys had floated away from the scene and he drank his liquor doggedly
7105-2340-0014.flac,4.895,10.852,0.556,such nice useful gifts a few duplicates of course,such nice lies in the prices of course
4294-9934-0013.flac,3.08,2.6,0.0,what are you going to do i do not know,what are you going to do i do not know
7105-2330-0033.flac,4.27,8.687000000000001,0.273,have you any band instruments of an easy nature to play,have you any man instruments of any nature to play
4852-28311-0001.flac,4.98,12.128,0.857,chris looked from a nickel plated flashlight to a car jack and spark plug,christ look from a complaint it flashed like to correct an sparkplug
2414-128292-0012.flac,2.71,5.176,1.0,thou art not pleasing unto me,the increasing income
7975-280084-0016.flac,6.3,13.818,0.545,the shutters were closed and this caused bunker an instant's delay that was almost fatal pitts chased him with a bullet,the shutters were closed in this case back and instantly there was almost fatal victim of a bullet
3997-180297-0020.flac,7.735,18.329,0.45,such a man i found in the duke but the duke is old and old age neither protects nor consoles,such a man i found it out but the duke is of an old and neither protocols
3528-168656-0009.flac,2.785,4.574,0.2,they lost themselves in conjectures,they lost himself in conjectures
8280-266249-0039.flac,8.375,19.957,0.63,that fellow nick ward is a noted blackleg and ruffian had his nose broken in a fight and is sensitive on the subject was cheating of course,that's a nice word is another black wagon russia has now broken in this sensitive on the subject was being of course
6128-63240-0003.flac,7.005,11.756,0.25,just as i am the visitor inquired presenting himself with rather a work a day aspect,just as i am the visitor inquired presenting himself with rather a workaday aspects
8188-269290-0030.flac,2.33,4.751,0.25,i'll wait for you here said leslie,i'll wait for you here endlessly
4852-28330-0016.flac,5.37,8.54,0.067,yes sir i think i can do it safely or i should not try sir,yes sir i think i can do it safely or should not try sir
3528-168669-0025.flac,2.37,3.3770000000000002,0.25,you know that a mother died this morning,you know that another died this morning
3331-159605-0019.flac,9.78,24.567,0.583,at a street corner a black eyed school boy was parting from a rosy faced school girl whose music roll he was reluctantly surrendering,a street corner obliged schoolboy was partly from a rosy face schoolgirl whose musically was reluctantly centre
4852-28330-0002.flac,6.225,14.408,0.556,next ned cilley was relieved at the helm by elbert jones who took over ned went on down,next time was running into the home over jonesy took over then went on down
3538-163622-0007.flac,3.74,7.859,0.154,come hither come hither my handsome son and let me comb your hair,come hither come hither my hands and let me comb your hair
6432-63723-0033.flac,2.51,4.663,0.111,don't worry it will come out all right,don't worry you will come out all right
7902-96594-0010.flac,2.8,6.85,1.0,beg pardon sir didn't mean any harm,the consideration
533-1066-0007.flac,8.32,12.322000000000001,0.059,i mean he persisted do you feel as though you could go through with something rather unusual,i mean he persisted you feel as though you could go through with something rather unusual
8188-274364-0003.flac,8.32,17.625,0.32,the court which consisted of the chief officers of the army found the crime to be capital and condemned that nobleman to lose his head,the court which consisted of the officials of the army found the crown to the capital and condemned the noblemen to lose it
4852-28311-0013.flac,2.39,4.129,1.0,aw shucks,sharks
2609-156975-0014.flac,3.015,6.575,0.5,the making of a loyal patriot,the making of the leopard
7018-75789-0022.flac,7.8399375,11.254000000000001,0.08,i will tell you the story of my seventh and last voyage which is still more wondrous and marvellous than that of the first six,i will tell you the story of my seventh and last voyage which is still wondrous marvellous than that of the first six
6128-63240-0001.flac,4.325,8.41,0.273,that has an unflattering sound for me said the young man,that has an unpleasant sounds to me said the young man
4350-9170-0012.flac,10.665,18.669,0.237,but since this is not the case and on the contrary men in power are always far from being saints through the very fact of their possession of power the social organization based on power has no justification,since this is not the case on the contrary manpower always far from being sent through the very fact of their position of power the social organisation based on power has no justification
3005-163399-0026.flac,2.45,3.7960000000000003,0.0,the old gentleman stared and says,the old gentleman stared and says
3005-163399-0017.flac,2.405,4.021,0.143,children don't you say a word,sure don't you say a word
8131-117029-0019.flac,2.6500625,4.171,0.167,but his old eyes were glinting,but his own eyes were glinting
8188-269288-0016.flac,10.18,17.931,0.214,her eyes shone with pleasure at the anticipation of the delightful time she would have reveling in the home news the other letter was directed to annie colchester,her eyes shone with pleasure at the anticipation of the delightful time she would have revelling in the house the other little was directed to any purchaser
5764-299665-0091.flac,4.14,7.236,0.143,passion is and always has been deaf,passion is and always has been deaths
7018-75788-0013.flac,13.605,21.967000000000002,0.216,next morning as soon as it was light he prayed the dawn prayer and after blessing mohammed the cream of all creatures betook himself to the house of sindbad the seaman and wished him a good day,next morning ass soon ass it was light he cried the dawn prayer and after passing and the cream of all creatures betook himself to the house can be the same and wished him a good day
4198-61336-0020.flac,4.32,8.527,0.222,in the following year tiglath pileser returned to syria,in the following year to be returned to syria
3528-168669-0014.flac,1.995,3.2809999999999997,0.143,there is a ring in the stone,there was a ring in the stone
3997-180294-0031.flac,3.19,5.693,0.0,you still love me can you ask,you still love me can you ask
7105-2330-0027.flac,4.605,9.82,0.417,i'll try said the home secretary and went to the telephone,it is said that the secretary and went to the telephone
3538-163624-0000.flac,5.07,7.785,0.19,once upon a time there was a king in the north who had won many wars but now he was old,once upon a time there was a king in the north and in many ways but now he was old
3005-163390-0022.flac,2.14,4.796,0.2,well they all do jim,well they all do them
8461-278226-0012.flac,8.1,14.119,0.208,they have said that he is even a little imbecile that he does not remember himself of the most common events of his life,they have said this even a little bit so that he does not remember himself of the most common events of his life
4350-9170-0035.flac,3.875,5.475,0.222,this inconsistency has become obvious in universal military service,this inconsistency has become obvious and universal service
3764-168670-0000.flac,8.8,19.381,0.375,the strides of a lame man are like the ogling glances of a one eyed man they do not reach their goal very promptly,the stripes of a man like the elegances of a one eyed man they do not reach the recovery properly
5442-41168-0015.flac,4.975,9.812999999999999,0.154,that is a matter for each man's own decision he said severely,that is a matter for each man s own position he said severely
3764-168670-0055.flac,5.925,13.138,0.316,the priest says the prayers makes the sign of the cross sprinkles the holy water and takes his departure,the priests of the press at the sign of the cross sprinkles water and takes his departure
7975-280085-0009.flac,6.02,10.793000000000001,0.217,we were in sight of our long sought horses when they cut us off from the animals and our last hope was gone,we were in sight of alongside horses when they cut off from the animals in our last hope was gone
8188-269288-0044.flac,4.31,9.747,0.818,annie stared vacantly at the cocoa then she uttered a laugh,any study of the cocoa butter aloft
7018-75788-0003.flac,13.335,25.622,0.14,upon this he brought me a cotton bag and giving it to me said take this bag and fill it with pebbles from the beach and go forth with a company of the townsfolk to whom i will give a charge respecting thee,upon this he brought me a cotton back and giving it to me said take this back and fill it with apples from the beach and gave forth with a company of the townsfolk to him i will give a charge respecting them
3005-163391-0008.flac,13.265,28.093000000000004,0.32,he asked the king where he was going and the king told him he'd come down the river and landed at the other village this morning and now he was going up a few mile to see an old friend on a farm up there the young fellow says,tat the king when he was gone and the king tom had come down the river and landed at the other villages this morning and now he was going up a few miles to see an old friend and former there the young foxes
4852-28319-0008.flac,4.645,7.399,0.125,then as nothing happened with a voice like a whip mister wicker said start at once,that is nothing happened with a voice like a whip mister wicker said start at once
2414-159411-0008.flac,3.26,6.62,0.4,is it just that he should do so or no,it is just that he should do so now
7902-96595-0018.flac,8.345,24.446,0.812,gurr saluted and stated his business while the baronet who had turned sallower and more careworn than his lot drew a breath full of relief one of your ship boys he said,the solution to this business with the baronet who had to save another one another before one person
3331-159609-0004.flac,10.4,23.066,0.312,tom wrote once a week to his mother but the letters were short and not very satisfactory for men never do tell the interesting little things that women best like to hear,tat once more to his mother but the letters were short and not very satisfactory for the inevitable interesting little things tat women best like to hear
8131-117017-0009.flac,6.285,10.679,0.316,some turned away as gordon and the other cop went to work but most of them weren't squeamish,some turned away scorn on the other cope to work but most of them were squeamish
7105-2330-0020.flac,2.945,8.045,0.7,anyway he won't go unless he has a band,anyway you won't glasses and
5442-41168-0011.flac,8.69,18.389,0.167,to escape from this painful feeling he went away into the other room where there was nobody except the waiters at the refreshment bar,to escape from this painful feeling he went away into the other room where there was nobody except the waters of the freshly
3331-159605-0042.flac,2.99,6.417999999999999,0.2,i just gave him a hint and he took it,i just gave him the hand and he took it
8188-269288-0027.flac,4.4,8.556000000000001,0.167,just after midnight she rose with a sigh to prepare for bed,just after midnight she rose with a sigh to pay for it
5764-299665-0038.flac,5.03,10.235,0.5,as people advance the remote consequences are perceived,a people advanced in remote consequences are achieved
6432-63723-0055.flac,8.135,20.702,0.219,i went over them the other day and noticed some were missing though i saw them all when i paid a visit to her just a short time before she was killed,i went over the other day and not something that i saw them all i paid a visit to her just a short time before she was killed
3005-163399-0028.flac,2.15,4.77,0.75,it's tom sawyer,is this you
4294-35475-0022.flac,21.19,64.597,0.483,the grandame whom he supplied with fagots the merchant whom he rescued from robbers the king's councillor to whom he gave aid all became his friends up and down the land to beggar or lord homeless wanderer or high born dame he gladly gave unselfish service all unsought and such as he helped straightway became his friends,the grandam who is supplied with facts the merchant whom he rescued from robert the king s counselors to whom he gave became a sense up and down the plant beggarly tales under his body he gladly give unselfish service outside and such ass he held straightaway became his friends
4198-12281-0013.flac,11.65,17.96,0.5,some died without speaking others spoke without dying some died in speaking others spoke in dying,some time without speaking others but without the somethin speaking others spoke and i
4350-9170-0016.flac,7.47,12.418999999999999,0.182,after conquest the power of the emperor puts an end to internal dissensions and so the state conception of life justifies itself,after conquest the power of the emperor put an end to internal dissensions and so the state conception of my justification
3538-163619-0003.flac,3.045,7.389,0.5,kiss me girl said the head,that said the head
1688-142285-0049.flac,5.08,7.787,0.0,i had forgotten what i said for the time continued margaret quietly,i had forgotten what i said for the time continued margaret quietly
5764-299665-0054.flac,10.715,26.099,0.375,the puritan believed the bible to be the word of god and this belief has always made those who held it cruel and wretched,the puritan believed it to be the word of god and the belief is always that those who have cruelly and rigid
3528-168669-0088.flac,2.53,3.508,0.2,we are ignorant and impious,we are ignorant and others
7975-280057-0013.flac,2.675,3.564,0.167,every knot represented a human life,every not represented a human life
4852-28319-0022.flac,3.695,5.791,0.0,certain elements were to be mixed and poured at the proper time,certain elements were to be mixed and poured at the proper time
2414-128292-0002.flac,2.59,5.586,0.6,what matter about my shadow,but what about me shadow
8131-117017-0007.flac,4.115,8.228,0.75,you damned cops can't o'neill was blubbering,we democrats can only as blubbering
6070-86744-0015.flac,12.07,19.544,0.219,i will confess to you albert replied franz the count is a very singular person and the appointment you have made to meet him in paris fills me with a thousand apprehensions,i will confess to you all that replied franz the countess a very singular person and the appointments are made to meet him in paris fills me with a thousand apprehensions
3997-180297-0025.flac,6.77,13.652000000000001,0.105,marguerite drew the letter from her bosom and handing it to me with a smile of infinite sweetness said,marguerite drew a letter from her bosom and handing it to me with a smile infinite sweetness said
3528-168669-0100.flac,2.265,4.641,0.556,the office for the dead will then be said,the office for the deadline set
3997-180297-0003.flac,4.3,7.992,0.25,during this remark marguerite looked at me attentively,during this remark but she looked at me attentively
7105-2330-0018.flac,7.175,19.617,0.24,he says he never has left prison without a brass band to play him out and he's not going to go without one now,he says he never has left prison without the basement to play him out and is not going to go into now
3331-159609-0021.flac,10.37,23.307,0.364,she kept much at home when the day's work was done finding it pleasanter to sit dreaming over book or sewing alone than to exert herself even to go to the shaws,she kept much at home in the days work was done finding a pleasant to these dreaming of a book or soon alone and to exert herself even to go to this house
3528-168669-0012.flac,3.79,8.343,0.4,and a woman is not a man but my brother is the strong one though,a woman is not about my brother is a strong one
3764-168671-0033.flac,1.69,1.612,0.0,the man replied,the man replied
5764-299665-0075.flac,3.395,5.633,0.0,i say what i think,i say what i think
367-130732-0006.flac,2.35,5.623,1.0,lobster a la newberg,was allowed
5764-299665-0073.flac,10.25,18.572,0.4,it follows that nothing has been or can be created that there never has been or can be a creator,it follows that nothing has been a complicated that they never have been or can be created
3538-142836-0015.flac,9.78,25.067999999999998,0.484,marmalades and jams differ little from each other they are preserves of a half liquid consistency made by boiling the pulp of fruits and sometimes part of the rinds with sugar,and james differ little from each other the preserve of catholic resistance made by foiling the people this is sometimes part of the wines with sugar
3528-168669-0066.flac,3.75,4.814,0.0,you will have an iron bar yes but,you will have an iron bar yes but
3997-180294-0013.flac,2.875,6.04,0.143,they know not what proof to give,they know not what proved to give
5764-299665-0028.flac,4.48,12.094,0.538,he has tried that road and knows that it is the wrong road,is that the truth and knows that it is a wrong room
1688-142285-0082.flac,3.47,6.797000000000001,0.083,i may be the cinderella to put on the slipper after all,i may be the central to put on the slipper after all
4198-12281-0008.flac,18.81,41.36,0.468,hark you my masters you that love the wine cop's body follow me for sanct anthony burn me as freely as a faggot if they get leave to taste one drop of the liquor that will not now come and fight for relief of the vine,at your masters you that lovely copy follow me for that in italy as well as the fact that they can lead to tat one drop of the liquid that will not now come and fight for relief of the wine
4852-28319-0006.flac,3.255,7.1530000000000005,0.75,suppose i change and can't change back,i support a change in the back
1688-142285-0023.flac,2.585,2.6639999999999997,0.0,however out it came,however out it came
367-130732-0026.flac,18.52,44.971000000000004,0.344,take thirty crawfish from which remove the gut containing the gall in the following manner take firm hold of the crawfish with the left hand so as to avoid being pinched by its claws with the thumb and forefinger of the right hand pinch the extreme end of the central fin of the tail and with a sudden jerk the gut will be withdrawn,take thirty copies from which removed a containing the call in the following manner take a firm hold of the clashes with the left hand so as to avoid being pinches clash with the same informing of the right and the extreme end of essential find the time and with a sudden jerk the cost will be withdrawn
5764-299665-0019.flac,5.125,13.151,0.375,can we say that his mercy endureth forever,can we say that historic and out forever
7902-96591-0014.flac,9.71,17.855,0.275,the kick he had received was a foretaste of what he might expect and after a little consideration he came to the conclusion that his duty was to escape and get back to the cutter as quickly as he could,the king had received was a foretaste of what we can expect after a little consideration he came to the conclusion that this duty was to escape and get back to the castle she could
8188-269288-0049.flac,3.355,6.991,0.3,can't you manage with a candle just for once,have you met with a candle just for once
5442-41169-0005.flac,4.01,9.317,0.375,shall we go on your excellency fine champagne,shall we go in your excellency find them
533-131564-0024.flac,4.355,10.465,0.875,milicent flew to thank me overflowing with gratitude,miles inclusive overwhelming his gratitude
1688-142285-0067.flac,3.845,8.621,0.154,don't think hardly on him he's a good man he is,don't think hard on him he's a good man is
7902-96594-0008.flac,4.095,9.715,0.333,well sir said the master hesitating smugglers are smugglers,well sir said the master hesitating prisoners
1998-15444-0018.flac,6.51,14.606,0.375,the pure alkaloids with the exception of morphine in its crystalline form are soluble in ether,the pure collides with the exception of moving in its present form is in asia
